{
  "generatedFrom": {
    "cleanupLedger": "manifests/cleanup-ledger.json",
    "runtimeLinks": "manifests/runtime-links.json",
    "sourceRoots": "manifests/source-roots.json",
    "sourceTurnoffReadiness": "manifests/source-turnoff-readiness.json",
    "type": "RUNTIME_ACTIVATION_INPUTS"
  },
  "operations": [
    {
      "collisionPolicy": "BACKUP_THEN_LINK",
      "evidence": {
        "manifest": "manifests/runtime-links.json",
        "status": "PLANNED",
        "type": "RUNTIME_ACTIVATION_EVIDENCE"
      },
      "name": "agent-skill-children",
      "operationType": "ACTIVATE_RUNTIME_LINK",
      "primitiveTypes": [
        "SKILL"
      ],
      "requiresApproval": true,
      "runtimeLinkStrategy": "SYMLINK_CHILDREN",
      "sourcePath": "/Users/amichne/code/intelligence/skills",
      "status": "WAITING_APPROVAL",
      "steps": [
        {
          "commandPreview": "test -d /Users/amichne/code/intelligence/skills",
          "description": "Verify source directory exists",
          "type": "RUNTIME_ACTIVATION_STEP"
        },
        {
          "commandPreview": "ls -la /Users/amichne/.agents/skills 2>/dev/null || true",
          "description": "Review target directory before linking children",
          "type": "RUNTIME_ACTIVATION_STEP"
        },
        {
          "commandPreview": "mkdir -p /Users/amichne/.agents/skills",
          "description": "Prepare target directory after approval if needed",
          "type": "RUNTIME_ACTIVATION_STEP"
        },
        {
          "commandPreview": "find /Users/amichne/code/intelligence/skills -mindepth 1 -maxdepth 1 -type d -exec sh -c 'test -f \"$1/SKILL.md\" && echo ln -s \"$1\" \"$2/$(basename \"$1\")\"' sh '{}' /Users/amichne/.agents/skills ';'",
          "description": "Link eligible primitive children only after approval",
          "type": "RUNTIME_ACTIVATION_STEP"
        }
      ],
      "targetPath": "/Users/amichne/.agents/skills",
      "type": "RUNTIME_ACTIVATION_OPERATION"
    },
    {
      "collisionPolicy": "BACKUP_THEN_LINK",
      "evidence": {
        "manifest": "manifests/runtime-links.json",
        "status": "PLANNED",
        "type": "RUNTIME_ACTIVATION_EVIDENCE"
      },
      "name": "claude-agent-children",
      "operationType": "ACTIVATE_RUNTIME_LINK",
      "primitiveTypes": [
        "AGENT"
      ],
      "requiresApproval": true,
      "runtimeLinkStrategy": "SYMLINK_CHILDREN",
      "sourcePath": "/Users/amichne/code/intelligence/agents",
      "status": "WAITING_APPROVAL",
      "steps": [
        {
          "commandPreview": "test -d /Users/amichne/code/intelligence/agents",
          "description": "Verify source directory exists",
          "type": "RUNTIME_ACTIVATION_STEP"
        },
        {
          "commandPreview": "ls -la /Users/amichne/.claude/agents 2>/dev/null || true",
          "description": "Review target directory before linking children",
          "type": "RUNTIME_ACTIVATION_STEP"
        },
        {
          "commandPreview": "mkdir -p /Users/amichne/.claude/agents",
          "description": "Prepare target directory after approval if needed",
          "type": "RUNTIME_ACTIVATION_STEP"
        },
        {
          "commandPreview": "find /Users/amichne/code/intelligence/agents -mindepth 1 -maxdepth 1 \\( -type d -o -name '*.agent.md' \\) ! -name AGENTS.md -exec sh -c 'echo ln -s \"$1\" \"$2/$(basename \"$1\")\"' sh '{}' /Users/amichne/.claude/agents ';'",
          "description": "Link eligible primitive children only after approval",
          "type": "RUNTIME_ACTIVATION_STEP"
        }
      ],
      "targetPath": "/Users/amichne/.claude/agents",
      "type": "RUNTIME_ACTIVATION_OPERATION"
    },
    {
      "collisionPolicy": "FAIL_IF_EXISTS",
      "evidence": {
        "manifest": "manifests/runtime-links.json",
        "status": "PLANNED",
        "type": "RUNTIME_ACTIVATION_EVIDENCE"
      },
      "name": "codex-hook-adapters",
      "operationType": "ACTIVATE_RUNTIME_LINK",
      "primitiveTypes": [
        "HOOK"
      ],
      "requiresApproval": true,
      "runtimeLinkStrategy": "SYMLINK_CHILDREN",
      "sourcePath": "/Users/amichne/code/intelligence/hooks/codex",
      "status": "WAITING_APPROVAL",
      "steps": [
        {
          "commandPreview": "test -d /Users/amichne/code/intelligence/hooks/codex",
          "description": "Verify source directory exists",
          "type": "RUNTIME_ACTIVATION_STEP"
        },
        {
          "commandPreview": "ls -la /Users/amichne/.codex/hooks 2>/dev/null || true",
          "description": "Review target directory before linking children",
          "type": "RUNTIME_ACTIVATION_STEP"
        },
        {
          "commandPreview": "mkdir -p /Users/amichne/.codex/hooks",
          "description": "Prepare target directory after approval if needed",
          "type": "RUNTIME_ACTIVATION_STEP"
        },
        {
          "commandPreview": "find /Users/amichne/code/intelligence/hooks/codex -mindepth 1 -maxdepth 1 -type f -name '*.hooks.json' -exec sh -c 'echo ln -s \"$1\" \"$2/$(basename \"$1\")\"' sh '{}' /Users/amichne/.codex/hooks ';'",
          "description": "Link eligible primitive children only after approval",
          "type": "RUNTIME_ACTIVATION_STEP"
        }
      ],
      "targetPath": "/Users/amichne/.codex/hooks",
      "type": "RUNTIME_ACTIVATION_OPERATION"
    },
    {
      "collisionPolicy": "BACKUP_THEN_LINK",
      "evidence": {
        "manifest": "manifests/runtime-links.json",
        "status": "PLANNED",
        "type": "RUNTIME_ACTIVATION_EVIDENCE"
      },
      "name": "codex-skill-children",
      "operationType": "ACTIVATE_RUNTIME_LINK",
      "primitiveTypes": [
        "SKILL"
      ],
      "requiresApproval": true,
      "runtimeLinkStrategy": "SYMLINK_CHILDREN",
      "sourcePath": "/Users/amichne/code/intelligence/skills",
      "status": "WAITING_APPROVAL",
      "steps": [
        {
          "commandPreview": "test -d /Users/amichne/code/intelligence/skills",
          "description": "Verify source directory exists",
          "type": "RUNTIME_ACTIVATION_STEP"
        },
        {
          "commandPreview": "ls -la /Users/amichne/.codex/skills 2>/dev/null || true",
          "description": "Review target directory before linking children",
          "type": "RUNTIME_ACTIVATION_STEP"
        },
        {
          "commandPreview": "mkdir -p /Users/amichne/.codex/skills",
          "description": "Prepare target directory after approval if needed",
          "type": "RUNTIME_ACTIVATION_STEP"
        },
        {
          "commandPreview": "find /Users/amichne/code/intelligence/skills -mindepth 1 -maxdepth 1 -type d -exec sh -c 'test -f \"$1/SKILL.md\" && echo ln -s \"$1\" \"$2/$(basename \"$1\")\"' sh '{}' /Users/amichne/.codex/skills ';'",
          "description": "Link eligible primitive children only after approval",
          "type": "RUNTIME_ACTIVATION_STEP"
        }
      ],
      "targetPath": "/Users/amichne/.codex/skills",
      "type": "RUNTIME_ACTIVATION_OPERATION"
    },
    {
      "collisionPolicy": "SKIP_EXISTING",
      "evidence": {
        "manifest": "manifests/runtime-links.json",
        "status": "READY",
        "type": "RUNTIME_ACTIVATION_EVIDENCE"
      },
      "name": "codex-app-marketplace",
      "operationType": "IMPORT_MARKETPLACE",
      "primitiveTypes": [
        "PLUGIN",
        "SKILL",
        "AGENT",
        "HOOK",
        "INSTRUCTION"
      ],
      "requiresApproval": true,
      "runtimeLinkStrategy": "MARKETPLACE_IMPORT",
      "sourcePath": "/Users/amichne/code/intelligence/marketplace.json",
      "status": "READY_FOR_MANUAL_IMPORT",
      "steps": [
        {
          "commandPreview": "test -e /Users/amichne/code/intelligence/marketplace.json",
          "description": "Verify marketplace catalog exists",
          "type": "RUNTIME_ACTIVATION_STEP"
        },
        {
          "commandPreview": "open 'codex://plugins?marketplacePath=/Users/amichne/code/intelligence/marketplace.json'",
          "description": "Open marketplace import URL manually after approval",
          "type": "RUNTIME_ACTIVATION_STEP"
        }
      ],
      "targetPath": "codex://plugins?marketplacePath=/Users/amichne/code/intelligence/marketplace.json",
      "type": "RUNTIME_ACTIVATION_OPERATION"
    },
    {
      "backupPath": "/Users/amichne/code/intelligence/.migration-backups/source-turnoff/apollo-skills/agent-profile-authoring",
      "evidence": {
        "manifest": "manifests/cleanup-ledger.json",
        "reviewEvidenceSha256": "sha256:f7789cf6996c66a8ae0d09857c127c597bbeabaa5805be3d90b481374726c4f9",
        "status": "PROPOSED",
        "type": "RUNTIME_ACTIVATION_EVIDENCE"
      },
      "name": "replace-apollo-skills-agent-profile-authoring",
      "operationType": "REPLACE_SOURCE_WITH_SYMLINK",
      "requiresApproval": true,
      "sourcePath": "/Users/amichne/code/intelligence/skills/agent-profile-authoring",
      "status": "WAITING_APPROVAL",
      "steps": [
        {
          "commandPreview": "test -e /Users/amichne/code/intelligence/skills/agent-profile-authoring",
          "description": "Verify canonical source exists",
          "type": "RUNTIME_ACTIVATION_STEP"
        },
        {
          "commandPreview": "test -e /Users/amichne/code/apollo/skills/agent-profile-authoring",
          "description": "Verify current source exists before backup",
          "type": "RUNTIME_ACTIVATION_STEP"
        },
        {
          "commandPreview": "mkdir -p /Users/amichne/code/intelligence/.migration-backups/source-turnoff/apollo-skills",
          "description": "Prepare backup directory",
          "type": "RUNTIME_ACTIVATION_STEP"
        },
        {
          "commandPreview": "mv /Users/amichne/code/apollo/skills/agent-profile-authoring /Users/amichne/code/intelligence/.migration-backups/source-turnoff/apollo-skills/agent-profile-authoring",
          "description": "Back up current source path",